"user_id","image_paths","user_claim","claim_object","evidence_standard_met","evidence_standard_met_reason","risk_flags","issue_type","object_part","claim_status","claim_status_justification","supporting_image_ids","valid_image","severity"
"user_001","images/sample/case_001/img_1.jpg;images/sample/case_001/img_2.jpg","My car headlight was shattered in a parking lot collision yesterday","car","false","The images provided do not consistently show the claimed damage.","none","glass_shatter","headlight","contradicted","Image 1 shows a shattered headlight, but Image 2, which is of higher quality, shows no damage, contradicting the claim. The inconsistency between these two images raises doubts about the claim. Therefore, the claim is not supported by the visual evidence.","","true","none"
"user_002","images/sample/case_002/img_1.jpg;images/sample/case_002/img_2.jpg;images/sample/case_002/img_3.jpg","A rock hit my windshield on the highway causing a large crack, and my front bumper was also scratched","car","true","The claim meets the evidence standard as it includes multiple images that clearly show the damaged areas from different angles.","none","glass_shatter","windshield","supported","Image 1 (img_1) clearly shows a cracked windshield with multiple cracks and a large impact point, while Image 2 (img_2) shows a visible scratch on the front bumper, directly supporting the user's claim. The images are of good quality and clearly show the damaged areas, providing sufficient evidence for the claim. The user's history does not indicate any risk flags that would contradict the clear visual evidence.","img_1;img_2","true","medium"
"user_003","images/sample/case_003/img_1.jpg;images/sample/case_003/img_2.jpg","My car was damaged in a collision, the hood has dents and scratches","car","false","The images provided do not clearly show the damaged area from multiple angles as required.","user_history_risk;blurry_image","dent","hood","not_enough_information","Image 1 shows a blurry picture of the hood with small dents, but the quality of the image is poor. Image 2 does not show the claimed damage. The images do not provide sufficient clear visual evidence to support the claim. The user's history also indicates a medium risk score and prior fraud flags.","img_1","true","low"
"user_004","images/sample/case_004/img_1.jpg;images/sample/case_004/img_2.jpg","Another vehicle hit my car door and front bumper in a car park","car","true","The evidence standard is met because the images clearly show the damaged area from multiple angles","user_history_risk","unknown","unknown","supported","Image 1 (img_1) shows a noticeable dent on the car door, and Image 2 (img_2) shows a scratch on the front bumper, which directly supports the claim. The images are of good quality and show the damaged area clearly. The user's history has raised a risk flag, but the visual evidence is clear and supports the claim.","img_1;img_2","true","unknown"
"user_005","images/sample/case_005/img_1.jpg;images/sample/case_005/img_2.jpg;images/sample/case_005/img_3.jpg","My car sustained damage to the door, front bumper and rear bumper in a collision","car","true","The claim meets the evidence standard as it includes multiple images showing the damaged areas clearly from various angles.","user_history_risk","unknown","unknown","supported","The images provided, specifically img_1, img_2, and img_3, clearly show the damage to the door, front bumper, and rear bumper, supporting the user's claim. The images are of good quality, not blurry, and show the damaged areas from different angles. The evidence from these images outweighs the user's high risk score and history of prior claims.","img_1;img_2;img_3","true","unknown"
"user_006","images/sample/case_006/img_1.jpg;images/sample/case_006/img_2.jpg;images/sample/case_006/img_3.jpg","My laptop hinge snapped when I dropped my bag, the screen no longer opens properly","laptop","false","The evidence provided does not consistently show the claimed damage, with only one blurry image suggesting a broken hinge while other images show no damage.","blurry_image","broken_part","hinge","contradicted","Image 1 appears to show a broken hinge, but its blurry quality and the lack of visible damage in Images 2 and 3 contradict the claim. Image 2 and Image 3 show the laptop with no visible issues, casting doubt on the claim. Overall, the inconsistency across the images contradicts the user's claim.","img_1","true","high"
"user_007","images/sample/case_007/img_1.jpg;images/sample/case_007/img_2.jpg","My MacBook screen cracked after it fell off my desk onto a hard floor","laptop","true","At least one clear image shows the specific damaged component, meeting the evidence standard.","none","glass_shatter","screen","supported","Image 2 clearly shows the laptop screen cracked with a large impact point and spiderweb pattern of cracks, directly supporting the claim. Although Image 1 does not show damage, it does not contradict the claim of damage as Image 2 provides sufficient evidence. The user's history does not indicate any risk flags that would override the clear visual evidence provided by Image 2.","img_2","true","high"
